{
  "$schema": "./schema.json",
  "kurumAdi": "T.C.\nADALET BAKANLIĞI\nAnkara Adliyesi",
  "klasorBasligi": "DOĞRUDAN TEMİN EVRAKLARI",
  "konu": "2026 YILI YAPIM İŞLERİ",
  "yil": "2026",
  "klasorNo": "03",
  "renk": "#15803d",
  "genislik": "7.5cm",
  "altBilgi": "Destek Hizmetleri Şube Müdürlüğü"
}
